{
  "schemaVersion": 1,
  "workspaceId": "codemotion-milano-2026",
  "dataSnapshotDate": "2026-10-17",
  "description": "Solo schede base da materiali di partenza BacaroTech; nessun topic, domanda o ricerca generata. Import create-only.",
  "speakers": [
    {
      "id": "giulio-d-alessandro",
      "fullName": "Giulio D'Alessandro",
      "firstName": "Giulio",
      "lastName": "D'Alessandro",
      "headline": "AI Knowledge Architect at Poste Italiane",
      "organization": null,
      "biographyMd": "Giulio D'Alessandro is a philosophy graduate who turned to software. He joined Poste Italiane five years ago and started out as a DevOps engineer.\nThen AI arrived and sent him back where he began. When machines can build anything, the rare skill is knowing what's worth building — and why.\nHe now works in Poste Italiane's Digital Technology Office, between the rigour of formal models and the messiness of what people actually mean.",
      "photoUrl": null,
      "priority": false,
      "inDirectorySnapshot": true,
      "publicLinks": [],
      "sourceIds": [
        "snapshot-speakers-directory"
      ],
      "talkIds": [
        "talk-giulio-d-alessandro"
      ],
      "reviewFlags": [],
      "status": "active",
      "tags": [],
      "suggestedTags": [],
      "notesMd": ""
    }
  ],
  "talks": [
    {
      "id": "talk-giulio-d-alessandro",
      "speakerIds": [
        "giulio-d-alessandro"
      ],
      "title": "Weapon or Tool? An Ontological Approach to Enterprise Knowledge",
      "abstractMd": "",
      "language": null,
      "level": null,
      "alternateTitles": [],
      "sourceIds": [
        "snapshot-speakers-directory"
      ],
      "day": null,
      "time": null,
      "stage": null,
      "reviewFlags": [],
      "topic": null,
      "notesMd": ""
    }
  ],
  "sources": [
    {
      "id": "snapshot-speakers-directory",
      "kind": "imported_snapshot",
      "title": "Codemotion Milano 2026 — elenco speaker (testo fornito)",
      "url": null,
      "publisher": "Snapshot pagina speaker Codemotion",
      "notesMd": "81 voci estratte dal file di testo fornito. Non aggiungere automaticamente dati provenienti da altre fonti.",
      "tags": [
        "import",
        "speaker-directory"
      ],
      "status": "reviewed",
      "speakerIds": []
    }
  ],
  "interviewPlans": [
    {
      "id": "giulio-d-alessandro",
      "speakerId": "giulio-d-alessandro",
      "assignedToUid": null,
      "assignedToName": null,
      "status": "not_started",
      "interviewStatus": "unconfirmed",
      "priority": "normal",
      "targetQuestions": 4,
      "date": null,
      "startTime": null,
      "notesMd": ""
    }
  ],
  "materials": [],
  "insights": [],
  "questions": []
}
