{
  "schemaVersion": 1,
  "workspaceId": "codemotion-milano-2026",
  "dataSnapshotDate": "2026-10-17",
  "description": "Solo schede base da materiali di partenza BacaroTech; nessun topic, domanda o ricerca generata. Import create-only.",
  "speakers": [
    {
      "id": "paolo-caressa",
      "fullName": "Paolo Caressa",
      "firstName": "Paolo",
      "lastName": "Caressa",
      "headline": "GSE spa - IT Expert",
      "organization": "GSE",
      "biographyMd": "Formerly:\n- Math BS+MS & PhD.\n- Math researcher.\n- IT consultant.\n- Developer & quant @big bank.\n- Project manager, technical consultant & writer @small sw house.\n- Adjunct professor @\"Sapienza\" University (Rome).\n- Instructor @Deep Learning Italia.\n\nCurrently:\n- IT expert @GSE energy company.",
      "photoUrl": "https://cdn.sessionize.com/image/a0ac-400o400o1-JuJZHqwbWMmU3yYvLHrhBW.png",
      "priority": true,
      "inDirectorySnapshot": true,
      "publicLinks": [],
      "sourceIds": [
        "snapshot-priority-csv",
        "snapshot-speakers-directory"
      ],
      "talkIds": [
        "talk-paolo-caressa"
      ],
      "reviewFlags": [],
      "status": "active",
      "tags": [],
      "suggestedTags": [],
      "notesMd": ""
    }
  ],
  "talks": [
    {
      "id": "talk-paolo-caressa",
      "speakerIds": [
        "paolo-caressa"
      ],
      "title": "Critica dell'informatica pura",
      "abstractMd": "Le schede perforate, le macchine calcolatrici programmabili, gli operatori booleani, gli automi, le architetture di calcolo parallelo, le funzioni ricorsive, le lambda: sono solo esempi di concetti che gli informatici credono di aver scoperto, ma che in realtà hanno solo riscoperto dopo che alcuni filosofi, magari secoli prima, le avevano pensate.\n\nCosa possiamo imparare da questa storia? Che possiamo credere d’essere il miglior programmatore, architetto, informatico del mondo, ma molto probabilmente non lo siamo, e il miglior modo per diventarlo è capire di non esserlo.\n\nIl talk sarà disseminato di esempi tecnici, per cuori impavidi e menti aperte, somministrati in modo giocoso ma rigoroso perché, \"quanno se gioca bisogna esse' seri\".",
      "language": "it",
      "level": "Intermediate",
      "alternateTitles": [],
      "sourceIds": [
        "snapshot-priority-csv",
        "snapshot-speakers-directory"
      ],
      "day": null,
      "time": null,
      "stage": null,
      "reviewFlags": [],
      "topic": null,
      "notesMd": ""
    }
  ],
  "sources": [
    {
      "id": "snapshot-priority-csv",
      "kind": "imported_snapshot",
      "title": "Codemotion Milano 2026 — speaker prioritari (CSV fornito)",
      "url": null,
      "publisher": "BacaroTech / CSV di lavoro",
      "notesMd": "29 righe; elenco operativo BacaroTech. Non rappresenta conferma di intervista. Colonna Email esclusa volontariamente.",
      "tags": [
        "import",
        "prioritari"
      ],
      "status": "reviewed",
      "speakerIds": []
    },
    {
      "id": "snapshot-speakers-directory",
      "kind": "imported_snapshot",
      "title": "Codemotion Milano 2026 — elenco speaker (testo fornito)",
      "url": null,
      "publisher": "Snapshot pagina speaker Codemotion",
      "notesMd": "81 voci estratte dal file di testo fornito. Non aggiungere automaticamente dati provenienti da altre fonti.",
      "tags": [
        "import",
        "speaker-directory"
      ],
      "status": "reviewed",
      "speakerIds": []
    }
  ],
  "interviewPlans": [
    {
      "id": "paolo-caressa",
      "speakerId": "paolo-caressa",
      "assignedToUid": null,
      "assignedToName": null,
      "status": "not_started",
      "interviewStatus": "unconfirmed",
      "priority": "high",
      "targetQuestions": 4,
      "date": null,
      "startTime": null,
      "notesMd": ""
    }
  ],
  "materials": [],
  "insights": [],
  "questions": []
}
