{
  "schemaVersion": 1,
  "workspaceId": "codemotion-milano-2026",
  "dataSnapshotDate": "2026-10-17",
  "description": "Solo schede base da materiali di partenza BacaroTech; nessun topic, domanda o ricerca generata. Import create-only.",
  "speakers": [
    {
      "id": "edoardo-dusi",
      "fullName": "Edoardo Dusi",
      "firstName": "Edoardo",
      "lastName": "Dusi",
      "headline": "Senior Developer Relations Engineer",
      "organization": null,
      "biographyMd": "Edoardo is a Developer Relations Engineer. He has a strong software developer and team leader background, working on various projects and platforms. He is passionate about creating and sharing content that educates and inspires other developers, such as tech talks, videos, podcasts, conferences, and more. He enjoys connecting with the developer community and promoting the benefits of open source software.",
      "photoUrl": null,
      "priority": false,
      "inDirectorySnapshot": true,
      "publicLinks": [],
      "sourceIds": [
        "snapshot-speakers-directory"
      ],
      "talkIds": [
        "talk-edoardo-dusi"
      ],
      "reviewFlags": [],
      "status": "active",
      "tags": [],
      "suggestedTags": [],
      "notesMd": ""
    }
  ],
  "talks": [
    {
      "id": "talk-edoardo-dusi",
      "speakerIds": [
        "edoardo-dusi"
      ],
      "title": "Honey, We Predicted the Bits",
      "abstractMd": "",
      "language": null,
      "level": null,
      "alternateTitles": [],
      "sourceIds": [
        "snapshot-speakers-directory"
      ],
      "day": null,
      "time": null,
      "stage": null,
      "reviewFlags": [],
      "topic": null,
      "notesMd": ""
    }
  ],
  "sources": [
    {
      "id": "snapshot-speakers-directory",
      "kind": "imported_snapshot",
      "title": "Codemotion Milano 2026 — elenco speaker (testo fornito)",
      "url": null,
      "publisher": "Snapshot pagina speaker Codemotion",
      "notesMd": "81 voci estratte dal file di testo fornito. Non aggiungere automaticamente dati provenienti da altre fonti.",
      "tags": [
        "import",
        "speaker-directory"
      ],
      "status": "reviewed",
      "speakerIds": []
    }
  ],
  "interviewPlans": [
    {
      "id": "edoardo-dusi",
      "speakerId": "edoardo-dusi",
      "assignedToUid": null,
      "assignedToName": null,
      "status": "not_started",
      "interviewStatus": "unconfirmed",
      "priority": "normal",
      "targetQuestions": 4,
      "date": null,
      "startTime": null,
      "notesMd": ""
    }
  ],
  "materials": [],
  "insights": [],
  "questions": []
}
