{
  "schemaVersion": 1,
  "workspaceId": "codemotion-milano-2026",
  "dataSnapshotDate": "2026-10-17",
  "description": "Solo schede base da materiali di partenza BacaroTech; nessun topic, domanda o ricerca generata. Import create-only.",
  "speakers": [
    {
      "id": "danilo-deponti",
      "fullName": "Danilo Deponti",
      "firstName": "Danilo",
      "lastName": "Deponti",
      "headline": "Senior Software Engineer",
      "organization": null,
      "biographyMd": "Danilo Deponti is a Senior Software Engineer, currently working in Doctolib, where he helps build the internal AI-augmented developer tools. His work focuses on autonomous coding agents, AI orchestration, and developer productivity, turning experimental LLM tooling into something teams can trust in production. He's passionate about pushing the boundaries of what AI can do inside a real engineering organisation: from agent fleets and persistent memory to observability, cost control, and keeping humans meaningfully in the loop.",
      "photoUrl": null,
      "priority": false,
      "inDirectorySnapshot": true,
      "publicLinks": [],
      "sourceIds": [
        "snapshot-speakers-directory"
      ],
      "talkIds": [
        "talk-danilo-deponti"
      ],
      "reviewFlags": [],
      "status": "active",
      "tags": [],
      "suggestedTags": [],
      "notesMd": ""
    }
  ],
  "talks": [
    {
      "id": "talk-danilo-deponti",
      "speakerIds": [
        "danilo-deponti"
      ],
      "title": "When the Backlog Dispatches Itself: a Production Fleet of Autonomous AI Coding Agents",
      "abstractMd": "",
      "language": null,
      "level": null,
      "alternateTitles": [],
      "sourceIds": [
        "snapshot-speakers-directory"
      ],
      "day": null,
      "time": null,
      "stage": null,
      "reviewFlags": [],
      "topic": null,
      "notesMd": ""
    }
  ],
  "sources": [
    {
      "id": "snapshot-speakers-directory",
      "kind": "imported_snapshot",
      "title": "Codemotion Milano 2026 — elenco speaker (testo fornito)",
      "url": null,
      "publisher": "Snapshot pagina speaker Codemotion",
      "notesMd": "81 voci estratte dal file di testo fornito. Non aggiungere automaticamente dati provenienti da altre fonti.",
      "tags": [
        "import",
        "speaker-directory"
      ],
      "status": "reviewed",
      "speakerIds": []
    }
  ],
  "interviewPlans": [
    {
      "id": "danilo-deponti",
      "speakerId": "danilo-deponti",
      "assignedToUid": null,
      "assignedToName": null,
      "status": "not_started",
      "interviewStatus": "unconfirmed",
      "priority": "normal",
      "targetQuestions": 4,
      "date": null,
      "startTime": null,
      "notesMd": ""
    }
  ],
  "materials": [],
  "insights": [],
  "questions": []
}
